text,label,is_augmented
how to diagnose hemophilia?,diagnosis,
what are the symptoms of acinetobacter in healthcare settings?,symptom,
what are the stages of breast cancer?,definition,
is punctate palmoplantar keratoderma type i inherited?,genetics,
how many people are affected by gorlin syndrome?,general,
how many people are affected by triple a syndrome?,general,
what causes pyelonephritis: kidney infection?,cause,
what is (are) cdkl5-related disorder?,definition,
what are the symptoms of isolated acth deficiency?,symptom,
what are the treatments for schwartz jampel syndrome type 1?,treatment,
what is (are) diabetic heart disease?,definition,
what are the treatments for multifocal motor neuropathy?,treatment,
how to diagnose prostate enlargement: benign prostatic hyperplasia?,diagnosis,
what are the symptoms of annular pancreas?,symptom,
what are the treatments for essential pentosuria?,treatment,
"what are the symptoms of 48,xxyy syndrome?",symptom,
what are the stages of gallbladder cancer?,definition,
what are the symptoms of zunich neuroectodermal syndrome?,symptom,
how to diagnose lichen planus pigmentosus?,diagnosis,
is brody myopathy inherited?,genetics,
what are the treatments for zika virus infection?,treatment,
is mucolipidosis ii alpha/beta inherited?,genetics,
"what is (are) craniometaphyseal dysplasia, autosomal recessive type?",definition,
what is (are) scurvy?,definition,
what to do for nephrotic syndrome in adults?,general,
what is the outlook for multi-infarct dementia?,definition,
what is (are) hair loss?,definition,
what is (are) autism spectrum disorder?,definition,
what are the treatments for acanthoma?,treatment,
what are the treatments for sporadic hemiplegic migraine?,treatment,
what are the symptoms of mucolipidosis iii alpha/beta?,symptom,
what are the treatments for progressive external ophthalmoplegia?,treatment,
what are the symptoms of spondyloepimetaphyseal dysplasia with multiple dislocations?,symptom,
"what are the symptoms of natal teeth, intestinal pseudoobstruction and patent ductus?",symptom,
what are the treatments for anemia in chronic kidney disease?,treatment,
what is (are) pseudopelade of brocq?,definition,
what are the symptoms of brooks wisniewski brown syndrome?,symptom,
what are the genetic changes related to beta-mannosidosis?,genetics,
what is (are) otospondylomegaepiphyseal dysplasia?,definition,
what is (are) hearing disorders and deafness?,definition,
how to diagnose multiple sclerosis?,diagnosis,
what is (are) juvenile temporal arteritis?,definition,
how to diagnose 47 xxx syndrome?,diagnosis,
what are the symptoms of congenital dyserythropoietic anemia type 3?,symptom,
what are the treatments for kidney disease?,treatment,
what are the treatments for malignant hyperthermia?,treatment,
what is (are) spinocerebellar ataxia 3?,definition,
is microhydranencephaly inherited?,genetics,
what is (are) hypopituitarism?,definition,
what is (are) hydatidiform mole?,definition,
what are the symptoms of wernicke-korsakoff syndrome?,symptom,
what are the treatments for renal artery stenosis?,treatment,
what is (are) stiff person syndrome?,definition,
how to prevent pulmonary embolism?,general,
what are the symptoms of gas in the digestive tract?,symptom,
how to diagnose greig cephalopolysyndactyly syndrome?,diagnosis,
what are the genetic changes related to dmd-associated dilated cardiomyopathy?,genetics,
how to prevent alpha-1 antitrypsin deficiency?,general,
what are the symptoms of griscelli syndrome type 3?,symptom,
is naegeli-franceschetti-jadassohn syndrome/dermatopathia pigmentosa reticularis inherited?,genetics,
what are the symptoms of brugada syndrome 4?,symptom,
how to diagnose parasites - angiostrongyliasis (also known as angiostrongylus infection)?,diagnosis,
what research (or clinical trials) is being done for miller fisher syndrome?,general,
what is (are) n-acetylglutamate synthase deficiency?,definition,
what is (are) hepatitis?,definition,
what are the treatments for protein c deficiency?,treatment,
is oculodentodigital dysplasia inherited?,genetics,
what is (are) early-onset glaucoma?,definition,
what is (are) 18q deletion syndrome?,definition,
what are the genetic changes related to brugada syndrome?,genetics,
what are the treatments for rectal cancer?,treatment,
what is (are) neuropathy ataxia retinitis pigmentosa syndrome?,definition,
what are the symptoms of partington syndrome?,symptom,
how to diagnose osteochondritis dissecans?,diagnosis,
how many people are affected by familial isolated hyperparathyroidism?,general,
what are the genetic changes related to glycogen storage disease type vi?,genetics,
what is (are) endocarditis?,definition,
what is (are) surfactant dysfunction?,definition,
what are the symptoms of thoracic outlet syndrome?,symptom,
what research (or clinical trials) is being done for hereditary spastic paraplegia?,general,
what is (are) multiple familial trichoepithelioma?,definition,
what are the genetic changes related to optic atrophy type 1?,genetics,
what are the genetic changes related to familial dilated cardiomyopathy?,genetics,
what are the treatments for coats plus syndrome?,treatment,
what is (are) pierson syndrome?,definition,
what are the genetic changes related to hereditary antithrombin deficiency?,genetics,
what is (are) pycnodysostosis?,definition,
what is (are) camptocormism?,definition,
what is the treatment for vancomycin-resistant enterococci?,treatment,
what is (are) microcystic adnexal carcinoma?,definition,
what are the treatments for cherubism?,treatment,
how many people are affected by surfactant dysfunction?,general,
what is (are) charge syndrome?,definition,
what is the outlook for post-polio syndrome?,definition,
what are the symptoms of polyneuropathy mental retardation acromicria premature menopause?,symptom,
what are the genetic changes related to ataxia-telangiectasia?,genetics,
what are the symptoms of spinocerebellar ataxia 12?,symptom,
what are the symptoms of waardenburg syndrome type 2?,symptom,
what causes pyridoxine-dependent epilepsy?,cause,
what are the treatments for parasites - scabies?,treatment,
how many people are affected by fucosidosis?,general,
what causes von hippel-lindau disease?,cause,
what are the symptoms of hamanishi ueba tsuji syndrome?,symptom,
what is (are) malabsorption syndromes?,definition,
how many people are affected by benign recurrent intrahepatic cholestasis?,general,
is primary hyperoxaluria type 2 inherited?,genetics,
what causes pneumonia?,cause,
how many people are affected by fryns syndrome?,general,
what is (are) bartter syndrome?,definition,
what are the treatments for hemangioendothelioma?,treatment,
what are the genetic changes related to arts syndrome?,genetics,
what is (are) helicobacter pylori infections?,definition,
what are the genetic changes related to cog5-congenital disorder of glycosylation?,genetics,
what is (are) cluttering?,definition,
what is (are) familial idiopathic basal ganglia calcification?,definition,
what are the symptoms of langer mesomelic dysplasia?,symptom,
what are the symptoms of laurence prosser rocker syndrome?,symptom,
how to diagnose what i need to know about cirrhosis?,diagnosis,
how to diagnose coats disease?,diagnosis,
who is at risk for coronary heart disease?,risk,
what are the treatments for char syndrome?,treatment,
what are the symptoms of symphalangism with multiple anomalies of hands and feet?,symptom,
who is at risk for cough?,risk,
what are the genetic changes related to d-bifunctional protein deficiency?,genetics,
what are the treatments for familial hemophagocytic lymphohistiocytosis?,treatment,
what is (are) hay fever?,definition,
what are the treatments for geographic tongue?,treatment,
how to diagnose lujo hemorrhagic fever (luhf)?,diagnosis,
what to do for ectopic kidney?,general,
what is (are) childhood central nervous system atypical teratoid/rhabdoid tumor?,definition,
what are the treatments for spinal muscular atrophy with respiratory distress type 1?,treatment,
what are the genetic changes related to aromatic l-amino acid decarboxylase deficiency?,genetics,
what is (are) autoimmune lymphoproliferative syndrome?,definition,
how to prevent copd?,general,
do you have information about hiv/aids medicines,general,
what are the symptoms of gracile bone dysplasia?,symptom,
how many people are affected by beta-mannosidosis?,general,
what are the symptoms of occipital horn syndrome?,symptom,
what are the symptoms of yellow nail syndrome?,symptom,
what are the symptoms of myelofibrosis?,symptom,
what is (are) cone-rod dystrophy?,definition,
what is (are) bile duct diseases?,definition,
what are the symptoms of aniridia?,symptom,
what are the symptoms of retroperitoneal fibrosis?,symptom,
how many people are affected by lama2-related muscular dystrophy?,general,
what is (are) dyskeratosis congenita?,definition,
what are the genetic changes related to hereditary spherocytosis?,genetics,
how many people are affected by warsaw breakage syndrome?,general,
how to diagnose uterine sarcoma?,diagnosis,
how to diagnose crimean-congo hemorrhagic fever (cchf)?,diagnosis,
what are the treatments for central core disease?,treatment,
what are the symptoms of roch-leri mesosomatous lipomatosis?,symptom,
what is (are) vlcad deficiency?,definition,
what are the symptoms of west syndrome?,symptom,
what is (are) hypothyroidism?,definition,
what is the outlook for neuronal migration disorders?,definition,
"what are the symptoms of 46,xx testicular disorder of sex development?",symptom,
what is (are) bobble-head doll syndrome?,definition,
what is (are) familial restrictive cardiomyopathy?,definition,
is homocystinuria inherited?,genetics,
what is (are) alopecia universalis?,definition,
what is (are) thiamine responsive megaloblastic anemia syndrome?,definition,
what are the treatments for beckwith-wiedemann syndrome?,treatment,
how many people are affected by familial mediterranean fever?,general,
what is (are) overweight and obesity?,definition,
what causes iron-deficiency anemia?,cause,
how to diagnose central core disease?,diagnosis,
what are the treatments for age-related macular degeneration?,treatment,
how to prevent stroke?,general,
do you have information about antibiotic resistance,general,
what are the symptoms of neuroblastoma?,symptom,
what is (are) chromosome 4p deletion?,definition,
how to diagnose lemierre syndrome?,diagnosis,
what are the genetic changes related to autoimmune lymphoproliferative syndrome?,genetics,
what is (are) microcephalic osteodysplastic primordial dwarfism type 1?,definition,
what is (are) x-linked visceral heterotaxy 1?,definition,
what are the treatments for facioscapulohumeral muscular dystrophy?,treatment,
"who is at risk for ovarian, fallopian tube, and primary peritoneal cancer?",risk,
what is (are) penis disorders?,definition,
what are the treatments for familial periodic paralyses?,treatment,
do you have information about child development,general,
how many people are affected by ring chromosome 14 syndrome?,general,
what are the symptoms of bod syndrome?,symptom,
is meesmann corneal dystrophy inherited?,genetics,
is congenital dyserythropoietic anemia inherited?,genetics,
what is the outlook for moebius syndrome?,definition,
what are the genetic changes related to chediak-higashi syndrome?,genetics,
is hereditary hemorrhagic telangiectasia inherited?,genetics,
what are the genetic changes related to x-linked hyper igm syndrome?,genetics,
what causes majeed syndrome?,cause,
what to do for glomerular diseases?,general,
how many people are affected by refsum disease?,general,
is arginine:glycine amidinotransferase deficiency inherited?,genetics,
what are the symptoms of pyknoachondrogenesis?,symptom,
what is (are) bednar tumor?,definition,
what is (are) eec syndrome?,definition,
how to diagnose hendra virus disease (hev)?,diagnosis,
how to diagnose gm1 gangliosidosis?,diagnosis,
what is (are) abdominal pain?,definition,
how to diagnose hypopharyngeal cancer?,diagnosis,
what are the symptoms of marshall-smith syndrome?,symptom,
what is the outlook for motor neuron diseases?,definition,
is cytochrome c oxidase deficiency inherited?,genetics,
how many people are affected by cherubism?,general,
what are the symptoms of childhood nephrotic syndrome?,symptom,
what are the treatments for uncombable hair syndrome?,treatment,
what are the symptoms of charcot-marie-tooth disease type 2k?,symptom,
what is (are) dandy-walker syndrome?,definition,
what are the complications of inguinal hernia?,definition,
what causes irritable bowel syndrome in children?,cause,
what are the symptoms of cerebral gigantism jaw cysts?,symptom,
what is (are) stomach disorders?,definition,
"what are the symptoms of refsum disease, infantile form?",symptom,
what is (are) lchad deficiency?,definition,
what causes respiratory failure?,cause,
what are the genetic changes related to distal arthrogryposis type 1?,genetics,
do you have information about fluid and electrolyte balance,general,
what are the symptoms of cramp-fasciculation syndrome?,symptom,
what are the symptoms of severe congenital neutropenia x-linked?,symptom,
what is (are) family issues?,definition,
is neonatal progeroid syndrome inherited?,genetics,
what is (are) alopecia areata?,definition,
what causes kawasaki syndrome?,cause,
what is (are) spinocerebellar ataxia 15?,definition,
what are the treatments for gas in the digestive tract?,treatment,
what research (or clinical trials) is being done for chiari malformation?,general,
what are the symptoms of primary gastrointestinal melanoma?,symptom,
what are the genetic changes related to schimke immuno-osseous dysplasia?,genetics,
what are the symptoms of microcephalic osteodysplastic primordial dwarfism type 2?,symptom,
what are the treatments for megalencephaly?,treatment,
what are the treatments for peters plus syndrome?,treatment,
what are the symptoms of familial osteochondritis dissecans?,symptom,
how many people are affected by hypohidrotic ectodermal dysplasia?,general,
what research (or clinical trials) is being done for gastrointestinal carcinoid tumors?,general,
what are the treatments for unna-thost palmoplantar keratoderma?,treatment,
what is (are) fungal infections?,definition,
what are the treatments for atopic dermatitis?,treatment,
do you have information about e-cigarettes,general,
do you have information about blood transfusion and donation,general,
what is (are) guanidinoacetate methyltransferase deficiency?,definition,
what research (or clinical trials) is being done for lambert-eaton myasthenic syndrome?,general,
what is (are) plasminogen activator inhibitor type 1 deficiency?,definition,
what is (are) alpha-methylacyl-coa racemase deficiency?,definition,
what are the symptoms of nephrotic syndrome in adults?,symptom,
what are the treatments for shprintzen-goldberg syndrome?,treatment,
what is (are) autosomal recessive cerebellar ataxia type 1?,definition,
what research (or clinical trials) is being done for machado-joseph disease?,general,
what is (are) kluver bucy syndrome?,definition,
what research (or clinical trials) is being done for tabes dorsalis?,general,
what are the treatments for argininosuccinic aciduria?,treatment,
do you have information about medical device safety,general,
what are the genetic changes related to rothmund-thomson syndrome?,genetics,
how to diagnose fowler's syndrome?,diagnosis,
how many people are affected by tetrahydrobiopterin deficiency?,general,
how many people are affected by trichohepatoenteric syndrome?,general,
what are the treatments for anemia?,treatment,
what is (are) asbestos-related lung diseases?,definition,
what are the treatments for klver-bucy syndrome?,treatment,
how to diagnose lafora disease?,diagnosis,
who is at risk for varicose veins?,risk,
what causes glioblastoma?,cause,
what is (are) what i need to know about kidney failure and how its treated?,treatment,
what causes viral hepatitis: a through e and beyond?,cause,
what is (are) trisomy 18?,definition,
how many people are affected by familial pityriasis rubra pilaris?,general,
what are the treatments for anencephaly?,treatment,
what is (are) craniofacial microsomia?,definition,
what causes madelung disease?,cause,
what to do for kidney stones in adults?,general,
what are the treatments for hypersensitivity pneumonitis?,treatment,
how many people are affected by crigler-najjar syndrome?,general,
what is (are) bronchitis?,definition,
what is the outlook for williams syndrome?,definition,
what are the genetic changes related to iron-refractory iron deficiency anemia?,genetics,
what is (are) hereditary sensory and autonomic neuropathy?,definition,
what are the symptoms of muckle-wells syndrome?,symptom,
what is (are) blood disorders?,definition,
is russell-silver syndrome inherited?,genetics,
what are the treatments for atypical hemolytic-uremic syndrome?,treatment,
what are the treatments for hyperlysinemia?,treatment,
what are the symptoms of mckusick kaufman syndrome?,symptom,
how many people are affected by pyridoxal 5'-phosphate-dependent epilepsy?,general,
what is (are) familial glucocorticoid deficiency?,definition,
what are the treatments for myotonic dystrophy?,treatment,
what to do for hemochromatosis?,general,
what are the treatments for asthma?,treatment,
is epidermolysis bullosa simplex inherited?,genetics,
what is (are) renal hypouricemia?,definition,
what are the treatments for triosephosphate isomerase deficiency?,treatment,
how to prevent sudden cardiac arrest?,general,
what is (are) keratitis-ichthyosis-deafness syndrome?,definition,
what are the genetic changes related to lysinuric protein intolerance?,genetics,
who is at risk for high blood pressure?,risk,
what is (are) heart attack?,definition,
what are the treatments for pdgfrb-associated chronic eosinophilic leukemia?,treatment,
what is the outlook for autism?,definition,
what is (are) extragonadal germ cell tumors?,definition,
is tarsal-carpal coalition syndrome inherited?,genetics,
what are the symptoms of retinoblastoma?,symptom,
what are the symptoms of transient neonatal diabetes mellitus?,symptom,
what causes amelogenesis imperfecta?,cause,
what are the symptoms of wyburn mason's syndrome?,symptom,
what research (or clinical trials) is being done for plasma cell neoplasms (including multiple myeloma)?,general,
how many people are affected by pdgfrb-associated chronic eosinophilic leukemia?,general,
how to diagnose mitochondrial genetic disorders?,genetics,
what is (are) coats plus syndrome?,definition,
what is (are) pneumocystis infections?,definition,
how many people are affected by x-linked creatine deficiency?,general,
how to prevent parasites - american trypanosomiasis (also known as chagas disease)?,general,
what are the symptoms of coasy protein-associated neurodegeneration?,symptom,
what are the treatments for oropharyngeal cancer?,treatment,
what is (are) microhydranencephaly?,definition,
how many people are affected by phosphoglycerate mutase deficiency?,general,
"what are the symptoms of ehlers-danlos syndrome, progeroid type?",symptom,
what are the treatments for logopenic progressive aphasia?,treatment,
what is (are) 11-beta-hydroxylase deficiency?,definition,
what are the treatments for ring chromosome 20 syndrome?,treatment,
what are the symptoms of distal myopathy with vocal cord weakness?,symptom,
what are the treatments for succinic semialdehyde dehydrogenase deficiency?,treatment,
is epidermolysis bullosa acquisita inherited?,genetics,
what is (are) pompe disease?,definition,
"what is (are) methemoglobinemia, beta-globin type?",definition,
what is (are) ovarian low malignant potential tumors?,definition,
what is (are) kidney failure: choosing a treatment that's right for you?,treatment,
do you have information about vitamin k,general,
what are the symptoms of enthesitis-related juvenile idiopathic arthritis?,symptom,
"what is (are) x-linked immunodeficiency with magnesium defect, epstein-barr virus infection, and neoplasia?",definition,
what are the symptoms of valinemia?,symptom,
what are the symptoms of pulmonary hypertension?,symptom,
what is (are) accessory navicular bone?,definition,
what are the symptoms of behcet's disease?,symptom,
what are the symptoms of holes in the heart?,symptom,
what is (are) spondylocostal dysostosis 3?,definition,
what are the genetic changes related to fish-eye disease?,genetics,
what is (are) simple kidney cysts?,definition,
how many people are affected by chops syndrome?,general,
what are the treatments for punctate palmoplantar keratoderma type i?,treatment,
what is (are) fg syndrome?,definition,
what are the genetic changes related to septo-optic dysplasia?,genetics,
how to prevent acinetobacter in healthcare settings?,general,
is pilomatrixoma inherited?,genetics,
what are the treatments for granuloma annulare?,treatment,
what are the symptoms of coccygodynia?,symptom,
what is (are) churg strauss syndrome?,definition,
what are the genetic changes related to tumor necrosis factor receptor-associated periodic syndrome?,genetics,
what is (are) cough?,definition,
how many people are affected by jacobsen syndrome?,general,
what are the genetic changes related to prothrombin deficiency?,genetics,
what are the genetic changes related to hajdu-cheney syndrome?,genetics,
what is (are) amyloidosis?,definition,
what are the treatments for giant congenital melanocytic nevus?,treatment,
what is (are) north american indian childhood cirrhosis?,definition,
how many people are affected by medullary cystic kidney disease type 1?,general,
is x-linked spondyloepiphyseal dysplasia tarda inherited?,genetics,
what are the symptoms of caudal appendage deafness?,symptom,
how to diagnose brody myopathy?,diagnosis,
what are the treatments for gray platelet syndrome?,treatment,
is medium-chain acyl-coenzyme a dehydrogenase deficiency inherited?,genetics,
what is (are) mucolipidosis type 4?,definition,
how many people are affected by autosomal dominant vitreoretinochoroidopathy?,general,
what is the outlook for metastatic squamous neck cancer with occult primary?,definition,
what is (are) pol iii-related leukodystrophy?,definition,
what is (are) hepatic encephalopathy?,definition,
is hystrix-like ichthyosis with deafness inherited?,genetics,
is myhre syndrome inherited?,genetics,
what research (or clinical trials) is being done for rett syndrome?,general,
what are the symptoms of normophosphatemic familial tumoral calcinosis?,symptom,
what is (are) urinary incontinence?,definition,
what are the genetic changes related to multiple system atrophy?,genetics,
what are the symptoms of trichothiodystrophy nonphotosensitive?,symptom,
what are the genetic changes related to familial adenomatous polyposis?,genetics,
what causes stiff person syndrome?,cause,
what is (are) inclusion body myopathy with early-onset paget disease and frontotemporal dementia?,definition,
what are the treatments for kbg syndrome?,treatment,
how to prevent diabetic heart disease?,general,
is gitelman syndrome inherited?,genetics,
is aniridia inherited?,genetics,
what is (are) congenital neuronal ceroid lipofuscinosis?,definition,
what are the treatments for apert syndrome?,treatment,
is congenital adrenal hyperplasia inherited?,genetics,
what are the symptoms of stroke?,symptom,
what are the treatments for tetra-amelia syndrome?,treatment,
what are the symptoms of microscopic polyangiitis?,symptom,
what are the genetic changes related to triple a syndrome?,genetics,
what causes cornelia de lange syndrome?,cause,
do you have information about infant and newborn development,general,
what causes 22q11.2 deletion syndrome?,cause,
what research (or clinical trials) is being done for extragonadal germ cell tumors?,general,
what causes hypoglycemia?,cause,
what are the treatments for stve-wiedemann syndrome?,treatment,
what is (are) diabetes type 1?,definition,
what is (are) waldenstrm macroglobulinemia?,definition,
what is (are) pyogenic granuloma?,definition,
what are the symptoms of hypokalemic periodic paralysis?,symptom,
what research (or clinical trials) is being done for osteoporosis?,general,
what is (are) parasitic diseases?,definition,
what causes adult central nervous system tumors?,cause,
what is (are) sick sinus syndrome?,definition,
how to diagnose gastritis?,diagnosis,
what research (or clinical trials) is being done for cerebral aneurysms?,general,
what are the symptoms of tricho-dento-osseous syndrome?,symptom,
what are the symptoms of chronic progressive external ophthalmoplegia?,symptom,
is mucopolysaccharidosis type vii inherited?,genetics,
what are the symptoms of tay-sachs disease?,symptom,
what is (are) beta thalassemia?,definition,
who is at risk for salivary gland cancer?,risk,
what is (are) beta-mannosidosis?,definition,
what are the genetic changes related to loeys-dietz syndrome?,genetics,
what research (or clinical trials) is being done for apraxia?,general,
how many people are affected by malignant hyperthermia?,general,
what to do for what i need to know about gas?,general,
what causes tourette syndrome?,cause,
what is (are) paraneoplastic syndromes?,definition,
what is the outlook for landau-kleffner syndrome?,definition,
what are the treatments for swyer-james syndrome?,treatment,
what is the outlook for brown-sequard syndrome?,definition,
what is (are) valley fever?,definition,
what is (are) pervasive developmental disorders?,definition,
how to diagnose primary hyperparathyroidism?,diagnosis,
"what is (are) blepharophimosis, ptosis, and epicanthus inversus syndrome type 1?",definition,
what are the symptoms of rhizomelic chondrodysplasia punctata type 3?,symptom,
how to diagnose childhood ependymoma?,diagnosis,
is gracile syndrome inherited?,genetics,
what are the symptoms of hereditary fructose intolerance?,symptom,
what are the symptoms of deafness and myopia syndrome?,symptom,
