text,label,is_augmented
what are the treatments for epithelial basement membrane corneal dystrophy?,treatment,
what are the symptoms of carney complex?,symptom,
how many people are affected by weill-marchesani syndrome?,general,
what is (are) chronic fatigue syndrome?,definition,
what are the genetic changes related to juvenile primary osteoporosis?,genetics,
how many people are affected by familial hyperaldosteronism?,general,
how many people are affected by sost-related sclerosing bone dysplasia?,general,
what are the genetic changes related to anhidrotic ectodermal dysplasia with immune deficiency?,genetics,
what are the genetic changes related to congenital hypothyroidism?,genetics,
what is (are) what i need to know about hepatitis b?,definition,
what are the symptoms of methylmalonic acidemia with homocystinuria?,symptom,
what is (are) mulibrey nanism?,definition,
how many people are affected by histidinemia?,general,
what is (are) leukocyte adhesion deficiency type 1?,definition,
what are the genetic changes related to palmoplantar keratoderma with deafness?,genetics,
how to prevent asthma?,general,
what is (are) supravalvular aortic stenosis?,definition,
what are the symptoms of hypopharyngeal cancer?,symptom,
what are the treatments for senior-lken syndrome?,treatment,
is focal dermal hypoplasia inherited?,genetics,
what are the symptoms of amniotic band syndrome?,symptom,
what is (are) bowen-conradi syndrome?,definition,
how many people are affected by early-onset primary dystonia?,general,
what is (are) carnitine-acylcarnitine translocase deficiency?,definition,
how many people are affected by iron-refractory iron deficiency anemia?,general,
do you have information about cancer alternative therapies,general,
what are the genetic changes related to limb-girdle muscular dystrophy?,genetics,
what is (are) vaginal bleeding?,definition,
what is (are) autosomal dominant vitreoretinochoroidopathy?,definition,
what is (are) x-linked juvenile retinoschisis?,definition,
what research (or clinical trials) is being done for leukodystrophy?,general,
how to prevent urinary tract infections?,general,
what is (are) cytogenetically normal acute myeloid leukemia?,definition,
what are the treatments for hemoglobin e disease?,treatment,
what is (are) gracile syndrome?,definition,
what is (are) adrenal gland cancer?,definition,
how to prevent parasites - baylisascaris infection?,general,
how many people are affected by myosin storage myopathy?,general,
what are the symptoms of syndrome of inappropriate antidiuretic hormone?,symptom,
what are the genetic changes related to farber lipogranulomatosis?,genetics,
how to diagnose situs inversus?,diagnosis,
what are the genetic changes related to gorlin syndrome?,genetics,
what research (or clinical trials) is being done for zellweger syndrome?,general,
how many people are affected by milroy disease?,general,
what is (are) lattice corneal dystrophy type i?,definition,
what is (are) x-linked infantile spasm syndrome?,definition,
how many people are affected by mucopolysaccharidosis type ii?,general,
what are the treatments for occipital neuralgia?,treatment,
what are the genetic changes related to thanatophoric dysplasia?,genetics,
what are the symptoms of epiphyseal dysplasia hearing loss dysmorphism?,symptom,
what is (are) trisomy 13?,definition,
what are the symptoms of diffuse panbronchiolitis?,symptom,
how to diagnose vlcad deficiency?,diagnosis,
what is (are) monitor your diabetes?,definition,
do you have information about farm health and safety,general,
do you have information about infant and newborn nutrition,general,
what is (are) head and neck squamous cell carcinoma?,definition,
what is (are) headache?,definition,
what causes syndrome of inappropriate antidiuretic hormone?,cause,
what is (are) pdgfrb-associated chronic eosinophilic leukemia?,definition,
what are the symptoms of rh incompatibility?,symptom,
what are the symptoms of dyskeratosis congenita autosomal recessive?,symptom,
what are the symptoms of charcot-marie-tooth disease type 2b1?,symptom,
what is (are) bladder diseases?,definition,
what are the treatments for hemolytic uremic syndrome in children?,treatment,
what are the treatments for primary lateral sclerosis?,treatment,
what are the treatments for atrial fibrillation and stroke?,treatment,
do you have information about evaluating health information,general,
what are the genetic changes related to frontonasal dysplasia?,genetics,
what is (are) donnai-barrow syndrome?,definition,
what are the treatments for holt-oram syndrome?,treatment,
what are the symptoms of pearson syndrome?,symptom,
what are the symptoms of mycosis fungoides and the szary syndrome?,symptom,
what are the symptoms of birdshot chorioretinopathy?,symptom,
what are the treatments for alpha-methylacyl-coa racemase deficiency?,treatment,
what is (are) pulmonary vein stenosis?,definition,
what is (are) mitochondrial trifunctional protein deficiency?,definition,
how many people are affected by renal tubular acidosis with deafness?,general,
what are the treatments for idiopathic pulmonary fibrosis?,treatment,
what are the symptoms of lethal congenital contracture syndrome 2?,symptom,
what causes prader-willi syndrome?,cause,
what are the treatments for polymyositis?,treatment,
what is (are) neuromuscular disorders?,definition,
what are the genetic changes related to wolff-parkinson-white syndrome?,genetics,
what is (are) lamellar ichthyosis?,definition,
what is (are) dermal eccrine cylindroma?,definition,
what causes alopecia universalis?,cause,
do you have information about hiv/aids in women,general,
what is (are) rh deficiency syndrome?,definition,
what are the treatments for autosomal dominant partial epilepsy with auditory features?,treatment,
what causes juvenile myoclonic epilepsy?,cause,
what are the genetic changes related to familial hemophagocytic lymphohistiocytosis?,genetics,
what are the genetic changes related to dyserythropoietic anemia and thrombocytopenia?,genetics,
how many people are affected by dystrophic epidermolysis bullosa?,general,
what research (or clinical trials) is being done for alzheimer's disease?,general,
how to diagnose adult primary liver cancer?,diagnosis,
how many people are affected by angelman syndrome?,general,
what are the symptoms of cleidocranial dysplasia?,symptom,
is familial dysautonomia inherited?,genetics,
is gray platelet syndrome inherited?,genetics,
what are the genetic changes related to glycogen storage disease type i?,genetics,
what to do for urinary tract infection in adults?,general,
what are the genetic changes related to axenfeld-rieger syndrome?,genetics,
what are the genetic changes related to renal tubular dysgenesis?,genetics,
what are the treatments for neonatal progeroid syndrome?,treatment,
"what are the genetic changes related to distal hereditary motor neuropathy, type v?",genetics,
what are the symptoms of cryptomicrotia brachydactyly syndrome?,symptom,
what is (are) nutrition for early chronic kidney disease in adults?,definition,
what causes poland syndrome?,cause,
what are the genetic changes related to familial male-limited precocious puberty?,genetics,
what are the treatments for pancreatic neuroendocrine tumors (islet cell tumors)?,treatment,
what is (are) pancreatitis?,definition,
how to diagnose intrahepatic cholestasis of pregnancy?,diagnosis,
what are the treatments for tularemia?,treatment,
what is (are) adult acute myeloid leukemia?,definition,
what are the genetic changes related to aspartylglucosaminuria?,genetics,
what are the symptoms of wt limb blood syndrome?,symptom,
is henoch-schonlein purpura inherited?,genetics,
what are the stages of bile duct cancer (cholangiocarcinoma)?,definition,
is ellis-van creveld syndrome inherited?,genetics,
what is (are) fahr's syndrome?,definition,
how to diagnose renal oncocytoma?,diagnosis,
what is (are) gonorrhea?,definition,
what are the symptoms of split hand foot malformation?,symptom,
how to diagnose pseudoxanthoma elasticum?,diagnosis,
what are the symptoms of familial encephalopathy with neuroserpin inclusion bodies?,symptom,
what is (are) parasites - zoonotic hookworm?,definition,
what is (are) cryptogenic cirrhosis?,definition,
what are the symptoms of vulvar cancer?,symptom,
what are the treatments for cytochrome p450 oxidoreductase deficiency?,treatment,
is supravalvular aortic stenosis inherited?,genetics,
what is the outlook for ataxia telangiectasia?,definition,
what are the treatments for chronic diarrhea in children?,treatment,
what is (are) warthin tumor?,definition,
what is (are) toxoplasmosis?,definition,
what are the genetic changes related to familial acute myeloid leukemia with mutated cebpa?,genetics,
what are the genetic changes related to acute promyelocytic leukemia?,genetics,
what are the treatments for mitochondrial myopathy?,treatment,
how to diagnose postural orthostatic tachycardia syndrome?,diagnosis,
what is (are) rickets?,definition,
what is the outlook for meralgia paresthetica?,definition,
what are the treatments for wernicke-korsakoff syndrome?,treatment,
what are the symptoms of ameloonychohypohidrotic syndrome?,symptom,
what are the symptoms of long qt syndrome 1?,symptom,
"what are the symptoms of tuberous sclerosis, type 1?",symptom,
how to diagnose mixed connective tissue disease?,diagnosis,
what is (are) nephronophthisis?,definition,
what are the stages of adult primary liver cancer?,definition,
what are the symptoms of brachydactyly type a2?,symptom,
what are the symptoms of porencephaly?,symptom,
what are the treatments for birt-hogg-dube syndrome?,treatment,
what are the symptoms of x-linked lymphoproliferative syndrome 1?,symptom,
is autoimmune atrophic gastritis inherited?,genetics,
who is at risk for parathyroid cancer?,risk,
who is at risk for parasites - lice - body lice?,risk,
how many people are affected by argininosuccinic aciduria?,general,
"what are the symptoms of arthrogryposis, distal, type 2e?",symptom,
what is (are) albright's hereditary osteodystrophy?,definition,
what are the symptoms of schwartz jampel syndrome type 1?,symptom,
how to diagnose childhood craniopharyngioma?,diagnosis,
what is (are) gallbladder cancer?,definition,
what are the treatments for thanatophoric dysplasia?,treatment,
what is the outlook for alpers' disease?,definition,
is tracheobronchopathia osteoplastica inherited?,genetics,
what are the genetic changes related to mpv17-related hepatocerebral mitochondrial dna depletion syndrome?,genetics,
what are the treatments for familial hypertrophic cardiomyopathy?,treatment,
what are the symptoms of kbg syndrome?,symptom,
what are the genetic changes related to mabry syndrome?,genetics,
what is (are) erythropoietic protoporphyria?,definition,
what are the genetic changes related to fragile x syndrome?,genetics,
what is (are) prickle1-related progressive myoclonus epilepsy with ataxia?,definition,
what research (or clinical trials) is being done for trigeminal neuralgia?,general,
is spastic paraplegia type 7 inherited?,genetics,
what is (are) hearing problems in children?,definition,
what are the genetic changes related to nephronophthisis?,genetics,
what are the genetic changes related to steatocystoma multiplex?,genetics,
what is the outlook for myotonia?,definition,
"what is (are) 46,xx testicular disorder of sex development?",definition,
what are the symptoms of hypomelia mullerian duct anomalies?,symptom,
what is (are) testicular disorders?,definition,
what are the genetic changes related to fukuyama congenital muscular dystrophy?,genetics,
what are the symptoms of primary myelofibrosis?,symptom,
what causes anemia of inflammation and chronic disease?,cause,
what is (are) schwartz jampel syndrome type 1?,definition,
how many people are affected by floating-harbor syndrome?,general,
what is (are) glucose phosphate isomerase deficiency?,definition,
"what is (are) ovarian, fallopian tube, and primary peritoneal cancer?",definition,
what research (or clinical trials) is being done for post-polio syndrome?,general,
what are the symptoms of michelin tire baby syndrome?,symptom,
"what are the symptoms of 49,xxxxx syndrome?",symptom,
what are the symptoms of goldberg-shprintzen megacolon syndrome?,symptom,
how to prevent alagille syndrome?,general,
how many people are affected by meesmann corneal dystrophy?,general,
how many people are affected by myotonia congenita?,general,
do you have information about drugs and young people,general,
what is (are) familial hdl deficiency?,definition,
what are the symptoms of chronic hiccups?,symptom,
is hereditary myopathy with early respiratory failure inherited?,genetics,
what is the outlook for skin cancer?,definition,
what is the outlook for tuberous sclerosis?,definition,
how many people are affected by essential tremor?,general,
what are the symptoms of gorlin chaudhry moss syndrome?,symptom,
is fanconi anemia inherited?,genetics,
what is (are) alg12-congenital disorder of glycosylation?,definition,
what are the treatments for autosomal dominant nocturnal frontal lobe epilepsy?,treatment,
what are the symptoms of abetalipoproteinemia?,symptom,
what are the treatments for primary hyperoxaluria type 2?,treatment,
what are the genetic changes related to fryns syndrome?,genetics,
what are the symptoms of bamforth syndrome?,symptom,
who is at risk for marfan syndrome?,risk,
what are the treatments for hereditary fructose intolerance?,treatment,
"what is (are) megalencephaly, polymicrogyria, and hydrocephalus (mpph) syndrome?",definition,
what are the symptoms of varicella virus antenatal infection?,symptom,
what is (are) cri du chat syndrome?,definition,
is glut1 deficiency syndrome inherited?,genetics,
what are the symptoms of townes-brocks syndrome?,symptom,
what is (are) refractive errors?,definition,
what is (are) dravet syndrome?,definition,
what is (are) weyers acrofacial dysostosis?,definition,
what is (are) tuberous sclerosis?,definition,
what are the treatments for parathyroid cancer?,treatment,
what are the treatments for weill-marchesani syndrome?,treatment,
what are the genetic changes related to xeroderma pigmentosum?,genetics,
what are the treatments for financial help for diabetes care?,treatment,
what are the treatments for esophageal atresia/tracheoesophageal fistula?,treatment,
is schwartz jampel syndrome type 1 inherited?,genetics,
what are the treatments for pili torti?,treatment,
what are the genetic changes related to menkes syndrome?,genetics,
what is (are) arginine:glycine amidinotransferase deficiency?,definition,
what is (are) lesch nyhan syndrome?,definition,
what causes pityriasis lichenoides et varioliformis acuta?,cause,
what is (are) leptin receptor deficiency?,definition,
how many people are affected by ataxia neuropathy spectrum?,general,
what are the genetic changes related to chanarin-dorfman syndrome?,genetics,
is andersen-tawil syndrome inherited?,genetics,
what causes adrenal insufficiency and addison's disease?,cause,
what are the symptoms of lopes gorlin syndrome?,symptom,
"what are the genetic changes related to platyspondylic lethal skeletal dysplasia, torrance type?",genetics,
what are the treatments for dowling-degos disease?,treatment,
what are the genetic changes related to von willebrand disease?,genetics,
how many people are affected by citrullinemia?,general,
what is (are) child sexual abuse?,definition,
what causes nicolaides-baraitser syndrome?,cause,
who is at risk for neuroblastoma?,risk,
what are the symptoms of kowarski syndrome?,symptom,
how to diagnose male breast cancer?,diagnosis,
what is the outlook for paranasal sinus and nasal cavity cancer?,definition,
what are the genetic changes related to adcy5-related dyskinesia?,genetics,
how many people are affected by turner syndrome?,general,
what causes cystocele?,cause,
what are the symptoms of spastic paraplegia facial cutaneous lesions?,symptom,
what are the symptoms of cone-rod dystrophy 6?,symptom,
what are the genetic changes related to fuchs endothelial dystrophy?,genetics,
who is at risk for arrhythmia?,risk,
what are the symptoms of ectrodactyly and ectodermal dysplasia without cleft lip/palate?,symptom,
what are the symptoms of scalp defects postaxial polydactyly?,symptom,
what are the genetic changes related to miller-dieker syndrome?,genetics,
what are the symptoms of seminoma?,symptom,
what are the treatments for neurofibromatosis type 1?,treatment,
what are the symptoms of lymphocytic vasculitis?,symptom,
what is the outlook for neuroblastoma?,definition,
what are the treatments for niemann-pick disease type a?,treatment,
what is (are) neurologic diseases?,definition,
"what are the symptoms of nystagmus, congenital motor, autosomal recessive?",symptom,
is multiple sclerosis inherited?,genetics,
how many people are affected by leydig cell hypoplasia?,general,
what are the symptoms of nance-horan syndrome?,symptom,
how to diagnose simple kidney cysts?,diagnosis,
what are the genetic changes related to birt-hogg-dub syndrome?,genetics,
how many people are affected by mayer-rokitansky-kster-hauser syndrome?,general,
is myoclonic epilepsy with ragged red fibers inherited?,genetics,
what are the treatments for surfactant dysfunction?,treatment,
what is (are) bell's palsy?,definition,
what are the symptoms of neurocutaneous melanosis?,symptom,
is hereditary folate malabsorption inherited?,genetics,
how many people are affected by familial osteochondritis dissecans?,general,
how many people are affected by apert syndrome?,general,
how to prevent skin cancer?,general,
how many people are affected by hereditary pancreatitis?,general,
what are the symptoms of premature aging okamoto type?,symptom,
what to do for hypothyroidism?,general,
what are the symptoms of osteosarcoma and malignant fibrous histiocytoma of bone?,symptom,
do you have information about weight control,general,
what is (are) kallmann syndrome?,definition,
who is at risk for testicular cancer?,risk,
what is the outlook for klippel-trenaunay syndrome (kts)?,definition,
what are the symptoms of acrocephalopolydactylous dysplasia?,symptom,
do you have information about pregnancy and medicines,general,
what are the treatments for rippling muscle disease?,treatment,
what are the symptoms of acute intermittent porphyria?,symptom,
what are the treatments for breast cancer?,treatment,
what is (are) stuttering?,definition,
what are the symptoms of cerebellar ataxia and hypogonadotropic hypogonadism?,symptom,
what are the genetic changes related to dystonia 6?,genetics,
what is (are) syringoma?,definition,
what are the symptoms of liver failure acute infantile?,symptom,
what is the outlook for spasticity?,definition,
what are the symptoms of fibular hypoplasia and complex brachydactyly?,symptom,
what are the genetic changes related to mevalonate kinase deficiency?,genetics,
what are the treatments for noonan syndrome 6?,treatment,
what are the genetic changes related to unverricht-lundborg disease?,genetics,
is kallmann syndrome inherited?,genetics,
what are the symptoms of cleft hand absent tibia?,symptom,
how many people are affected by uv-sensitive syndrome?,general,
how to diagnose cryptogenic organizing pneumonia?,diagnosis,
what is the outlook for klver-bucy syndrome?,definition,
how many people are affected by norrie disease?,general,
is zap70-related severe combined immunodeficiency inherited?,genetics,
what are the symptoms of x-linked charcot-marie-tooth disease type 1?,symptom,
is trimethylaminuria inherited?,genetics,
what is (are) hereditary leiomyomatosis and renal cell cancer?,definition,
what causes antiphospholipid antibody syndrome?,cause,
what is (are) kleefstra syndrome?,definition,
how many people are affected by kbg syndrome?,general,
what are the symptoms of mesomelia-synostoses syndrome?,symptom,
what to do for anemia of inflammation and chronic disease?,general,
what are the treatments for familial paroxysmal nonkinesigenic dyskinesia?,treatment,
how to diagnose henoch-schnlein purpura?,diagnosis,
what are the genetic changes related to laryngo-onycho-cutaneous syndrome?,genetics,
do you have information about infant and newborn care,general,
what are the symptoms of ledderhose disease?,symptom,
how to diagnose varicose veins?,diagnosis,
what is (are) familial hemiplegic migraine type 2?,definition,
how many people are affected by townes-brocks syndrome?,general,
how to diagnose crest syndrome?,diagnosis,
what are the symptoms of what i need to know about gas?,symptom,
how many people are affected by adenosine deaminase deficiency?,general,
is carnitine-acylcarnitine translocase deficiency inherited?,genetics,
is thoracic outlet syndrome inherited?,genetics,
what are the genetic changes related to autosomal recessive primary microcephaly?,genetics,
what are the symptoms of thymoma and thymic carcinoma?,symptom,
what research (or clinical trials) is being done for fibromuscular dysplasia?,general,
what causes high blood pressure?,cause,
how many people are affected by schimke immuno-osseous dysplasia?,general,
what are the genetic changes related to medullary cystic kidney disease type 1?,genetics,
what are the genetic changes related to autosomal recessive hyper-ige syndrome?,genetics,
what is (are) isolated ectopia lentis?,definition,
what are the treatments for primary myelofibrosis?,treatment,
how many people are affected by lymphangioleiomyomatosis?,general,
what is (are) kidney stones in children?,definition,
what research (or clinical trials) is being done for neuroacanthocytosis?,general,
what are the symptoms of tularemia?,symptom,
what are the symptoms of x-linked adrenal hypoplasia congenita?,symptom,
how many people are affected by lynch syndrome?,general,
do you have information about cocaine,general,
what are the symptoms of retinoschisis of fovea?,symptom,
what are the symptoms of spondylocostal dysostosis 2?,symptom,
what are the symptoms of beardwell syndrome?,symptom,
what is (are) inflammatory linear verrucous epidermal nevus?,definition,
what are the symptoms of verloove vanhorick brubakk syndrome?,symptom,
what is (are) floods?,definition,
what are the symptoms of hepatoblastoma?,symptom,
what causes hereditary cerebral hemorrhage with amyloidosis?,cause,
what is (are) mosaic trisomy 9?,definition,
what are the treatments for yellow nail syndrome?,treatment,
is pyridoxine-dependent epilepsy inherited?,genetics,
"what are the genetic changes related to 46,xx testicular disorder of sex development?",genetics,
what is the outlook for hemifacial spasm?,definition,
what causes what i need to know about crohn's disease?,cause,
who is at risk for heart disease in women?,risk,
what is the outlook for childhood acute myeloid leukemia and other myeloid malignancies?,definition,
"what is (are) twins, triplets, multiple births?",definition,
how many people are affected by acromicric dysplasia?,general,
what are the genetic changes related to amelogenesis imperfecta?,genetics,
how many people are affected by hashimoto thyroiditis?,general,
what to do for what i need to know about hirschsprung disease?,general,
is spina bifida inherited?,genetics,
what is the outlook for fabry disease?,definition,
what are the treatments for acute respiratory distress syndrome?,treatment,
what is (are) mcleod neuroacanthocytosis syndrome?,definition,
"what are the treatments for hypermanganesemia with dystonia, polycythemia, and cirrhosis?",treatment,
what are the symptoms of infantile-onset ascending hereditary spastic paralysis?,symptom,
what is (are) irritable bowel syndrome?,definition,
what are the symptoms of alopecia areata?,symptom,
what is (are) 15q11.2 microdeletion?,definition,
how many people are affected by celiac disease?,general,
what is the outlook for cerebral palsy?,definition,
what causes overview of kidney disease in children?,cause,
what are the treatments for foodborne illnesses?,treatment,
what are the symptoms of mesomelic dwarfism cleft palate camptodactyly?,symptom,
what is (are) kernicterus?,definition,
what are the symptoms of schisis association?,symptom,
what to do for porphyria?,general,
what is (are) menkes disease?,definition,
is shwachman-diamond syndrome inherited?,genetics,
what is (are) male breast cancer?,definition,
do you have information about veterans and military health,general,
what is the outlook for transient ischemic attack?,definition,
what is (are) giant congenital melanocytic nevus?,definition,
what are the symptoms of mevalonic aciduria?,symptom,
what is (are) vasculitis?,definition,
what is (are) bone marrow diseases?,definition,
what is (are) spondyloperipheral dysplasia?,definition,
"what are the symptoms of deafness, autosomal dominant nonsyndromic sensorineural 23?",symptom,
what are the symptoms of spinocerebellar ataxia x-linked type 3?,symptom,
what is (are) fuchs endothelial dystrophy?,definition,
what are the treatments for fabry disease?,treatment,
what is (are) steatocystoma multiplex?,definition,
what is (are) problems with taste?,definition,
how to diagnose amyloidosis and kidney disease?,diagnosis,
what is (are) oxygen therapy?,treatment,
what causes urine blockage in newborns?,cause,
what are the symptoms of pulmonary alveolar proteinosis acquired?,symptom,
how to diagnose hanhart syndrome?,diagnosis,
what are the symptoms of aortic arch anomaly - peculiar facies - intellectual disability?,symptom,
what are the symptoms of immunoglobulin a deficiency 2?,symptom,
what are the symptoms of hodgkin lymphoma?,symptom,
what research (or clinical trials) is being done for incontinentia pigmenti?,general,
what is (are) wilms tumor?,definition,
how many people are affected by deafness and myopia syndrome?,general,
how many people are affected by multiple cutaneous and mucosal venous malformations?,general,
what is (are) mitochondrial neurogastrointestinal encephalopathy disease?,definition,
how many people are affected by chmp2b-related frontotemporal dementia?,general,
