text,label,is_augmented
what are the symptoms of dystonia 11?,symptom,
how many people are affected by x-linked dystonia-parkinsonism?,general,
do you have information about caregivers,general,
what is (are) x-linked severe combined immunodeficiency?,definition,
what is (are) hypertryptophanemia?,definition,
what are the symptoms of alkhurma hemorrhagic fever (ahf)?,symptom,
"how many people are affected by x-linked immunodeficiency with magnesium defect, epstein-barr virus infection, and neoplasia?",general,
what is (are) scot deficiency?,definition,
"what are the treatments for diabetes, heart disease, and stroke?",treatment,
is inclusion body myopathy 2 inherited?,genetics,
what are the symptoms of brca1 hereditary breast and ovarian cancer syndrome?,symptom,
is thrombocytopenia-absent radius syndrome inherited?,genetics,
what are the treatments for antiphospholipid antibody syndrome?,treatment,
what is (are) pseudocholinesterase deficiency?,definition,
what is the outlook for chorea?,definition,
how to diagnose alagille syndrome?,diagnosis,
how to prevent hypoglycemia?,general,
do you have information about environmental health,general,
what are the symptoms of pheochromocytoma-islet cell tumor syndrome?,symptom,
how many people are affected by congenital adrenal hyperplasia due to 11-beta-hydroxylase deficiency?,general,
do you have information about child mental health,general,
how many people are affected by myoclonic epilepsy with ragged-red fibers?,general,
what are the symptoms of pernicious anemia?,symptom,
is hypophosphatasia inherited?,genetics,
what research (or clinical trials) is being done for paranasal sinus and nasal cavity cancer?,general,
how many people are affected by aicardi-goutieres syndrome?,general,
what is (are) lesch-nyhan syndrome?,definition,
"what are the symptoms of hypomagnesemia 2, renal?",symptom,
how to diagnose parsonage turner syndrome?,diagnosis,
what is (are) multiple sclerosis?,definition,
is langer mesomelic dysplasia inherited?,genetics,
what are the symptoms of lambdoid synostosis?,symptom,
what are the treatments for progressive osseous heteroplasia?,treatment,
what are the symptoms of alopecia epilepsy oligophrenia syndrome of moynahan?,symptom,
how many people are affected by frontometaphyseal dysplasia?,general,
what causes basilar migraine?,cause,
what are the genetic changes related to emery-dreifuss muscular dystrophy?,genetics,
what are the symptoms of aicardi-goutieres syndrome type 4?,symptom,
what are the treatments for childhood central nervous system atypical teratoid/rhabdoid tumor?,treatment,
what are the treatments for guttate psoriasis?,treatment,
how many people are affected by leber congenital amaurosis?,general,
do you have information about eye wear,general,
is ochoa syndrome inherited?,genetics,
what are the genetic changes related to short qt syndrome?,genetics,
what are the symptoms of benign paroxysmal positional vertigo?,symptom,
do you have information about body weight,general,
is dystrophic epidermolysis bullosa inherited?,genetics,
how many people are affected by ichthyosis with confetti?,general,
what are the symptoms of ceroid lipofuscinosis neuronal 1?,symptom,
what are the genetic changes related to meesmann corneal dystrophy?,genetics,
what are the treatments for pituitary tumors?,treatment,
what is (are) mucopolysaccharidosis type iiic?,definition,
what are the symptoms of cornelia de lange syndrome?,symptom,
what are the symptoms of pyridoxine-dependent epilepsy?,symptom,
is primary myelofibrosis inherited?,genetics,
what is (are) pseudoachondroplasia?,definition,
what to do for irritable bowel syndrome in children?,general,
is relapsing polychondritis inherited?,genetics,
what is (are) sclerosing mucoepidermoid carcinoma with eosinophilia?,definition,
what is (are) alstrm syndrome?,definition,
what are the treatments for pernicious anemia?,treatment,
how to diagnose national hormone and pituitary program (nhpp): information for people treated with pituitary human growth hormone (comprehensive report)?,treatment,
how many people are affected by mucopolysaccharidosis type iii?,general,
is myotonic dystrophy type 1 inherited?,genetics,
do you have information about motor vehicle safety,general,
what are the symptoms of amelogenesis imperfecta local hypoplastic?,symptom,
what is (are) barth syndrome?,definition,
what are the treatments for ocular albinism?,treatment,
how to diagnose punctate palmoplantar keratoderma type i?,diagnosis,
what is (are) pulmonary embolism?,definition,
how many people are affected by hereditary antithrombin deficiency?,general,
how many people are affected by walker-warburg syndrome?,general,
what are the treatments for essential thrombocythemia?,treatment,
what are the symptoms of cushing disease?,symptom,
what are the treatments for notalgia paresthetica?,treatment,
what research (or clinical trials) is being done for tardive dyskinesia?,general,
what is (are) phosphoglycerate dehydrogenase deficiency?,definition,
how to diagnose klippel feil syndrome?,diagnosis,
what is (are) retinal vasculopathy with cerebral leukodystrophy?,definition,
who is at risk for parasites - angiostrongyliasis (also known as angiostrongylus infection)?,risk,
what are the treatments for buschke-ollendorff syndrome?,treatment,
what causes catamenial pneumothorax?,cause,
what is (are) turner syndrome?,definition,
how many people are affected by pontocerebellar hypoplasia?,general,
what are the genetic changes related to smith-lemli-opitz syndrome?,genetics,
is dolk-congenital disorder of glycosylation inherited?,genetics,
what is (are) best vitelliform macular dystrophy?,definition,
what is (are) dehydration?,definition,
what are the treatments for aspergillosis?,treatment,
what is (are) kniest dysplasia?,definition,
what are the genetic changes related to pulmonary arterial hypertension?,genetics,
what are the treatments for meningitis and encephalitis?,treatment,
what are the symptoms of charcot-marie-tooth disease type 2f?,symptom,
how many people are affected by peters plus syndrome?,general,
how many people are affected by pilomatricoma?,general,
what is (are) causes of diabetes?,cause,
what are the treatments for omenn syndrome?,treatment,
what is (are) malonyl-coa decarboxylase deficiency?,definition,
what are the genetic changes related to factor v deficiency?,genetics,
what are the treatments for peripheral arterial disease (p.a.d.)?,treatment,
"what are the symptoms of genu valgum, st helena familial?",symptom,
how many people are affected by x-linked infantile nystagmus?,general,
what are the symptoms of juvenile osteoporosis?,symptom,
what is (are) spider bites?,definition,
what are the treatments for chronic inflammatory demyelinating polyneuropathy?,treatment,
what is (are) asthma in children?,definition,
what is (are) ectopic pregnancy?,definition,
how many people are affected by metatropic dysplasia?,general,
what are the symptoms of cerebral palsy ataxic?,symptom,
what are the symptoms of cerebral sclerosis similar to pelizaeus-merzbacher disease?,symptom,
what is (are) infantile refsum disease?,definition,
what is (are) schwannomatosis?,definition,
what are the treatments for laryngo-onycho-cutaneous syndrome?,treatment,
what is (are) pityriasis rubra pilaris?,definition,
how many people are affected by juvenile hyaline fibromatosis?,general,
what is (are) digestive diseases?,definition,
what are the treatments for spasticity?,treatment,
what are the genetic changes related to pseudohypoaldosteronism type 1?,genetics,
what is (are) glycogen storage disease type 0?,definition,
what are the treatments for muckle-wells syndrome?,treatment,
how many people are affected by vacterl association?,general,
what are the symptoms of tetraamelia with ectodermal dysplasia and lacrimal duct abnormalities?,symptom,
what are the treatments for cri du chat syndrome?,treatment,
do you have information about drinking water,general,
what is (are) harlequin ichthyosis?,definition,
what are the treatments for mitochondrial neurogastrointestinal encephalopathy disease?,treatment,
what are the symptoms of dandy-walker malformation with facial hemangioma?,symptom,
what is (are) charcot-marie-tooth disease type 2b?,definition,
how to diagnose peyronie's disease?,diagnosis,
what are the genetic changes related to greenberg dysplasia?,genetics,
what is (are) spondylocostal dysostosis 2?,definition,
is glycogen storage disease type 4 inherited?,genetics,
is atelosteogenesis type 2 inherited?,genetics,
is hermansky-pudlak syndrome inherited?,genetics,
who is at risk for gastrointestinal stromal tumors?,risk,
what are the symptoms of symmetrical thalamic calcifications?,symptom,
what are the symptoms of ovarian germ cell tumors?,symptom,
how many people are affected by x-linked chondrodysplasia punctata 1?,general,
what is (are) lujan syndrome?,definition,
what are the symptoms of trigeminal neuralgia?,symptom,
who is at risk for anemia of inflammation and chronic disease?,risk,
what is (are) acquired pure red cell aplasia?,definition,
what are the genetic changes related to snyder-robinson syndrome?,genetics,
what are the treatments for pachyonychia congenita?,treatment,
is hepatic lipase deficiency inherited?,genetics,
what are the symptoms of merkel cell carcinoma?,symptom,
what are the genetic changes related to donnai-barrow syndrome?,genetics,
"what are the symptoms of deafness, autosomal recessive 51?",symptom,
what are the genetic changes related to vldlr-associated cerebellar hypoplasia?,genetics,
what are the symptoms of transposition of the great arteries?,symptom,
what are the genetic changes related to mcleod neuroacanthocytosis syndrome?,genetics,
how to diagnose mosaic trisomy 9?,diagnosis,
is hereditary spherocytosis inherited?,genetics,
what are the symptoms of gollop coates syndrome?,symptom,
what are the symptoms of charcot-marie-tooth disease type 2g?,symptom,
how to prevent gastritis?,general,
what are the treatments for chronic fatigue syndrome (cfs)?,treatment,
what are the symptoms of fraser like syndrome?,symptom,
what are the symptoms of renal dysplasia diffuse cystic?,symptom,
what are the genetic changes related to pyridoxal 5'-phosphate-dependent epilepsy?,genetics,
what are the treatments for striatonigral degeneration?,treatment,
what are the symptoms of jansen type metaphyseal chondrodysplasia?,symptom,
what are the symptoms of geleophysic dwarfism?,symptom,
what are the symptoms of duchenne muscular dystrophy?,symptom,
what are the symptoms of spondylospinal thoracic dysostosis?,symptom,
"what are the symptoms of crigler najjar syndrome, type 1?",symptom,
what is (are) frontometaphyseal dysplasia?,definition,
how many people are affected by progressive familial heart block?,general,
what is (are) precocious puberty?,definition,
what are the treatments for richter syndrome?,treatment,
what research (or clinical trials) is being done for pancreatic cancer?,general,
what is (are) tarlov cysts?,definition,
what is (are) spastic paraplegia type 15?,definition,
what is (are) branchio-oculo-facial syndrome?,definition,
what are the symptoms of paroxysmal ventricular fibrillation?,symptom,
how to prevent crimean-congo hemorrhagic fever (cchf)?,general,
what are the treatments for trichotillomania?,treatment,
what are the symptoms of microcystic adnexal carcinoma?,symptom,
what is (are) arts syndrome?,definition,
do you have information about dialysis,general,
what are the symptoms of urinary tract infections in children?,symptom,
what is (are) hereditary sensory and autonomic neuropathy type ie?,definition,
what are the symptoms of ablepharon macrostomia syndrome?,symptom,
what are the treatments for citrullinemia type i?,treatment,
what causes froelich syndrome?,cause,
what are the symptoms of crimean-congo hemorrhagic fever (cchf)?,symptom,
how many people are affected by primary carnitine deficiency?,general,
what is the outlook for arachnoid cysts?,definition,
how many people are affected by klippel-feil syndrome?,general,
how to prevent hendra virus disease (hev)?,general,
is leukonychia totalis inherited?,genetics,
what are the treatments for mabry syndrome?,treatment,
how to diagnose alzheimer's caregiving?,diagnosis,
how to diagnose oropharyngeal cancer?,diagnosis,
what are the symptoms of schnitzler syndrome?,symptom,
what are the treatments for hypochromic microcytic anemia with iron overload?,treatment,
how many people are affected by alpha thalassemia?,general,
what is (are) myelomeningocele?,definition,
what are the symptoms of pyruvate carboxylase deficiency?,symptom,
what are the symptoms of charcot-marie-tooth disease type 2b?,symptom,
what is (are) esophageal cancer?,definition,
is fragile x syndrome inherited?,genetics,
what are the treatments for col4a1-related brain small-vessel disease?,treatment,
is schindler disease type 1 inherited?,genetics,
who is at risk for non-small cell lung cancer?,risk,
what is (are) dislocations?,definition,
how to diagnose hemochromatosis?,diagnosis,
what are the treatments for zellweger syndrome?,treatment,
what is (are) pediatric crohn's disease?,definition,
what is (are) iron-refractory iron deficiency anemia?,definition,
do you have information about mammography,general,
what are the symptoms of penile cancer?,symptom,
is aromatase excess syndrome inherited?,genetics,
what are the symptoms of weissenbacher-zweymuller syndrome?,symptom,
how many people are affected by adult polyglucosan body disease?,general,
what are the treatments for colon cancer?,treatment,
what is (are) cant syndrome?,definition,
is frontonasal dysplasia inherited?,genetics,
do you have information about sexual health,general,
how many people are affected by juvenile primary osteoporosis?,general,
what is (are) horizontal gaze palsy with progressive scoliosis?,definition,
what are the symptoms of chromosome xp22 deletion syndrome?,symptom,
what are the treatments for peroxisomal acyl-coa oxidase deficiency?,treatment,
what are the treatments for progressive pseudorheumatoid dysplasia?,treatment,
what are the symptoms of diabetes mellitus type 1?,symptom,
what is (are) blepharospasm?,definition,
what are the treatments for mitochondrial complex iv deficiency?,treatment,
what is (are) dubin-johnson syndrome?,definition,
what are the genetic changes related to transthyretin amyloidosis?,genetics,
what research (or clinical trials) is being done for spinal cord infarction?,general,
how many people are affected by alpha-mannosidosis?,general,
what is (are) hypophosphatemic rickets?,definition,
how many people are affected by neurofibromatosis type 2?,general,
what is the outlook for hydromyelia?,definition,
what are the genetic changes related to lafora progressive myoclonus epilepsy?,genetics,
what are the genetic changes related to carbamoyl phosphate synthetase i deficiency?,genetics,
how to diagnose stiff person syndrome?,diagnosis,
what are the symptoms of prader-willi syndrome?,symptom,
what are the treatments for muscular dystrophy?,treatment,
do you have information about rural health concerns,general,
what are the symptoms of dwarfism tall vertebrae?,symptom,
what is (are) coronary microvascular disease?,definition,
is hereditary sensory neuropathy type ia inherited?,genetics,
who is at risk for parasites - trichuriasis (also known as whipworm infection)?,risk,
what is the outlook for tourette syndrome?,definition,
how to diagnose rheumatoid arthritis?,diagnosis,
how many people are affected by myopathy with deficiency of iron-sulfur cluster assembly enzyme?,general,
what causes neurofibromatosis type 1?,cause,
what is (are) osteopetrosis autosomal recessive 4?,definition,
what causes juvenile huntington disease?,cause,
what is (are) ehlers-danlos syndrome?,definition,
what are the treatments for myxopapillary ependymoma?,treatment,
what are the treatments for tarsal-carpal coalition syndrome?,treatment,
what are the symptoms of nasopharyngeal cancer?,symptom,
what are the symptoms of tietze syndrome?,symptom,
what are the symptoms of guillain-barre syndrome?,symptom,
what is (are) chromosome 8p deletion?,definition,
what causes limbic encephalitis?,cause,
what research (or clinical trials) is being done for breast cancer?,general,
"what is (are) distal hereditary motor neuropathy, type ii?",definition,
what are the treatments for roberts syndrome?,treatment,
what are the treatments for urinary tract infection in adults?,treatment,
what is the outlook for complex regional pain syndrome?,definition,
what research (or clinical trials) is being done for batten disease?,general,
what are the symptoms of buschke ollendorff syndrome?,symptom,
what are the treatments for non-small cell lung cancer?,treatment,
what is (are) crest syndrome?,definition,
what is (are) variant creutzfeldt-jakob disease?,definition,
what are the symptoms of galloway-mowat syndrome?,symptom,
"what are the symptoms of usher syndrome, type 1c?",symptom,
how many people are affected by amish lethal microcephaly?,general,
what causes bartter syndrome?,cause,
what are the treatments for erb-duchenne and dejerine-klumpke palsies?,treatment,
how many people are affected by familial exudative vitreoretinopathy?,general,
what is (are) hereditary diffuse leukoencephalopathy with spheroids?,definition,
what are the treatments for bronchiectasis?,treatment,
how many people are affected by enlarged parietal foramina?,general,
"what are the symptoms of prekallikrein deficiency, congenital?",symptom,
what are the treatments for saethre-chotzen syndrome?,treatment,
is dowling-degos disease inherited?,genetics,
what are the treatments for progressive transformation of germinal centers?,treatment,
how to prevent coronary heart disease?,general,
what is the outlook for neurological complications of aids?,definition,
is glycogen storage disease type iii inherited?,genetics,
what is (are) galloway-mowat syndrome?,definition,
what to do for goodpasture syndrome?,general,
what is (are) vacterl association?,definition,
what are the genetic changes related to 3-methylglutaconyl-coa hydratase deficiency?,genetics,
what are the symptoms of brachydactyly type c?,symptom,
how to diagnose hairy cell leukemia?,diagnosis,
what are the treatments for 16p11.2 deletion syndrome?,treatment,
what are the treatments for catamenial pneumothorax?,treatment,
what are the genetic changes related to nonsyndromic aplasia cutis congenita?,genetics,
how to diagnose myelodysplastic/ myeloproliferative neoplasms?,diagnosis,
is 15q13.3 microdeletion inherited?,genetics,
what research (or clinical trials) is being done for mucopolysaccharidoses?,general,
what are the genetic changes related to mycosis fungoides?,genetics,
how to diagnose adult soft tissue sarcoma?,diagnosis,
how many people are affected by wiskott-aldrich syndrome?,general,
how many people are affected by neonatal onset multisystem inflammatory disease?,general,
what are the treatments for urinary tract infections?,treatment,
what are the symptoms of harrod doman keele syndrome?,symptom,
what is (are) mitochondrial dna-associated leigh syndrome?,definition,
what are the treatments for spastic paraplegia type 31?,treatment,
who is at risk for endocarditis?,risk,
"how many people are affected by neuropathy, ataxia, and retinitis pigmentosa?",general,
how to diagnose hashimoto's disease?,diagnosis,
what are the treatments for alzheimer's disease?,treatment,
what are the symptoms of carnitine-acylcarnitine translocase deficiency?,symptom,
what are the genetic changes related to galactosemia?,genetics,
how is rabies diagnosed?,diagnosis,
what are the symptoms of renal hamartomas nephroblastomatosis and fetal gigantism?,symptom,
what is the outlook for isaacs' syndrome?,definition,
what are the symptoms of adenocarcinoma of the appendix?,symptom,
what is (are) intestinal cancer?,definition,
is glycogen storage disease type i inherited?,genetics,
what research (or clinical trials) is being done for dyslexia?,general,
what are the symptoms of botulism?,symptom,
is malignant migrating partial seizures of infancy inherited?,genetics,
what are the symptoms of glucose-6-phosphate dehydrogenase deficiency?,symptom,
what are the genetic changes related to adenine phosphoribosyltransferase deficiency?,genetics,
what are the treatments for iridocorneal endothelial syndrome?,treatment,
what are the symptoms of norrie disease?,symptom,
how many people are affected by romano-ward syndrome?,general,
what is (are) disseminated superficial actinic porokeratosis?,definition,
what are the symptoms of ehlers-danlos-like syndrome due to tenascin-x deficiency?,symptom,
how to diagnose coach syndrome?,diagnosis,
how to diagnose glomerular diseases?,diagnosis,
what are the symptoms of chromosome 4q deletion?,symptom,
what is (are) guttate psoriasis?,definition,
what are the treatments for intraocular (uveal) melanoma?,treatment,
what are the symptoms of his bundle tachycardia?,symptom,
what research (or clinical trials) is being done for generalized gangliosidoses?,general,
what are the symptoms of woodhouse sakati syndrome?,symptom,
what causes chondrocalcinosis 2?,cause,
what is (are) binswanger's disease?,definition,
"what is (are) x-linked intellectual disability, siderius type?",definition,
is timothy syndrome inherited?,genetics,
what are the treatments for klippel-feil syndrome?,treatment,
how to diagnose dumping syndrome?,diagnosis,
what are the symptoms of ascher syndrome?,symptom,
what is (are) nodular nonsuppurative panniculitis?,definition,
what is (are) progressive external ophthalmoplegia?,definition,
what is (are) cardiofaciocutaneous syndrome?,definition,
is glutathione synthetase deficiency inherited?,genetics,
how many people are affected by pseudocholinesterase deficiency?,general,
what are the symptoms of dennis fairhurst moore syndrome?,symptom,
what is the outlook for antiphospholipid syndrome?,definition,
what are the treatments for mycosis fungoides?,treatment,
what is (are) tetralogy of fallot?,definition,
what are the treatments for pigmented purpuric eruption?,treatment,
what are the genetic changes related to congenital stromal corneal dystrophy?,genetics,
what are the symptoms of waardenburg syndrome type 3?,symptom,
what to do for hashimoto's disease?,general,
what is the outlook for small intestine cancer?,definition,
what is (are) pitt-hopkins syndrome?,definition,
"what are the symptoms of pituitary hormone deficiency, combined 4?",symptom,
who is at risk for small intestine cancer?,risk,
what is (are) degenerative nerve diseases?,definition,
what is (are) pure autonomic failure?,definition,
what are the treatments for early-onset glaucoma?,treatment,
who is at risk for parasites - hookworm?,risk,
what are the genetic changes related to renpenning syndrome?,genetics,
what are the symptoms of hydrops fetalis?,symptom,
what is (are) small intestine cancer?,definition,
what causes hereditary fructose intolerance?,cause,
what is (are) pineal cyst?,definition,
what is (are) child behavior disorders?,definition,
how to diagnose pancreatic neuroendocrine tumors (islet cell tumors)?,diagnosis,
who is at risk for foodborne illnesses?,risk,
what are the treatments for baylisascaris infection?,treatment,
what is (are) neuronal ceroid lipofuscinosis 9?,definition,
what is (are) very long-chain acyl-coa dehydrogenase deficiency?,definition,
what are the symptoms of glaucoma 3 primary infantile b?,symptom,
what are the symptoms of familial colorectal cancer?,symptom,
what are the symptoms of abdominal aortic aneurysm?,symptom,
how many people are affected by protein s deficiency?,general,
what is (are) erdheim-chester disease?,definition,
what are the treatments for congenital heart defects?,treatment,
what is (are) head lice?,definition,
what are the genetic changes related to severe congenital neutropenia?,genetics,
what to do for biliary atresia?,general,
what are the genetic changes related to purine nucleoside phosphorylase deficiency?,genetics,
what are the treatments for cartilage-hair hypoplasia?,treatment,
what is the outlook for adult acute myeloid leukemia?,definition,
how many people are affected by gaucher disease?,general,
what is (are) melioidosis?,definition,
what are the treatments for chiari malformation type 1?,treatment,
how to prevent problems with smell?,general,
what are the genetic changes related to pseudocholinesterase deficiency?,genetics,
what are the treatments for spastic paraplegia type 8?,treatment,
what are the treatments for hemophagocytic lymphohistiocytosis?,treatment,
what are the symptoms of lysinuric protein intolerance?,symptom,
how many people are affected by porphyria?,general,
what is the outlook for agenesis of the corpus callosum?,definition,
what causes pelizaeus-merzbacher disease?,cause,
what are the treatments for microphthalmia with linear skin defects syndrome?,treatment,
how to diagnose mitochondrial encephalomyopathy lactic acidosis and stroke-like episodes?,diagnosis,
is aicardi-goutieres syndrome inherited?,genetics,
is familial paroxysmal kinesigenic dyskinesia inherited?,genetics,
is non-classic congenital adrenal hyperplasia due to 21-hydroxylase deficiency inherited?,genetics,
what research (or clinical trials) is being done for gerstmann's syndrome?,general,
what causes antisynthetase syndrome?,cause,
what are the treatments for isolated ectopia lentis?,treatment,
"what are the treatments for ohdo syndrome, say-barber-biesecker-young-simpson variant?",treatment,
what are the symptoms of leber hereditary optic neuropathy?,symptom,
what are the symptoms of varicose veins?,symptom,
what are the treatments for ataxia with vitamin e deficiency?,treatment,
what are the symptoms of juvenile myelomonocytic leukemia?,symptom,
what is (are) griscelli syndrome?,definition,
what is (are) wiedemann-steiner syndrome?,definition,
what is (are) parasites - american trypanosomiasis (also known as chagas disease)?,definition,
